{
  "schemaVersion": 1,
  "runId": "m2-b-host-api36-direct-transient-vpn",
  "sessionId": "m2-b-host-api36-direct-transient-vpn-session",
  "androidApi": 36,
  "clockDomain": "ANDROID_MONOTONIC",
  "events": [
    {
      "sequence": 1,
      "elapsedRealtimeNs": 1250000,
      "source": "MONITOR_LIFECYCLE",
      "signal": "MONITOR_STARTED",
      "disposition": "APPLIED",
      "platformRouteRef": null,
      "routeEpochBefore": null,
      "routeEpochAfter": null,
      "observedCapabilities": null,
      "observedBlocked": null,
      "runtimeStateAfter": {
        "state": "INITIALIZING",
        "routeEpoch": null,
        "capabilitiesReceived": false,
        "internet": "UNKNOWN",
        "validated": "UNKNOWN",
        "vpn": "UNKNOWN",
        "metered": "UNKNOWN",
        "restricted": "UNKNOWN",
        "blocked": "UNKNOWN",
        "suspended": "UNKNOWN"
      }
    },
    {
      "sequence": 2,
      "elapsedRealtimeNs": 1500000,
      "source": "DEFAULT_NETWORK_CALLBACK",
      "signal": "AVAILABLE",
      "disposition": "APPLIED",
      "platformRouteRef": "p1",
      "routeEpochBefore": null,
      "routeEpochAfter": 1,
      "observedCapabilities": null,
      "observedBlocked": null,
      "runtimeStateAfter": {
        "state": "AVAILABLE",
        "routeEpoch": 1,
        "capabilitiesReceived": false,
        "internet": "UNKNOWN",
        "validated": "UNKNOWN",
        "vpn": "UNKNOWN",
        "metered": "UNKNOWN",
        "restricted": "UNKNOWN",
        "blocked": "UNKNOWN",
        "suspended": "UNKNOWN"
      }
    },
    {
      "sequence": 3,
      "elapsedRealtimeNs": 1750000,
      "source": "DEFAULT_NETWORK_CALLBACK",
      "signal": "CAPABILITIES_CHANGED",
      "disposition": "APPLIED",
      "platformRouteRef": "p1",
      "routeEpochBefore": 1,
      "routeEpochAfter": 1,
      "observedCapabilities": {
        "internet": "TRUE",
        "validated": "TRUE",
        "vpn": "FALSE",
        "metered": "TRUE",
        "restricted": "FALSE",
        "suspended": "FALSE"
      },
      "observedBlocked": null,
      "runtimeStateAfter": {
        "state": "AVAILABLE",
        "routeEpoch": 1,
        "capabilitiesReceived": true,
        "internet": "TRUE",
        "validated": "TRUE",
        "vpn": "FALSE",
        "metered": "TRUE",
        "restricted": "FALSE",
        "blocked": "UNKNOWN",
        "suspended": "FALSE"
      }
    },
    {
      "sequence": 4,
      "elapsedRealtimeNs": 2000000,
      "source": "DEFAULT_NETWORK_CALLBACK",
      "signal": "LINK_PROPERTIES_CHANGED",
      "disposition": "UNCHANGED",
      "platformRouteRef": "p1",
      "routeEpochBefore": 1,
      "routeEpochAfter": 1,
      "observedCapabilities": null,
      "observedBlocked": null,
      "runtimeStateAfter": {
        "state": "AVAILABLE",
        "routeEpoch": 1,
        "capabilitiesReceived": true,
        "internet": "TRUE",
        "validated": "TRUE",
        "vpn": "FALSE",
        "metered": "TRUE",
        "restricted": "FALSE",
        "blocked": "UNKNOWN",
        "suspended": "FALSE"
      }
    },
    {
      "sequence": 5,
      "elapsedRealtimeNs": 2250000,
      "source": "DEFAULT_NETWORK_CALLBACK",
      "signal": "BLOCKED_CHANGED",
      "disposition": "APPLIED",
      "platformRouteRef": "p1",
      "routeEpochBefore": 1,
      "routeEpochAfter": 1,
      "observedCapabilities": null,
      "observedBlocked": "FALSE",
      "runtimeStateAfter": {
        "state": "AVAILABLE",
        "routeEpoch": 1,
        "capabilitiesReceived": true,
        "internet": "TRUE",
        "validated": "TRUE",
        "vpn": "FALSE",
        "metered": "TRUE",
        "restricted": "FALSE",
        "blocked": "FALSE",
        "suspended": "FALSE"
      }
    },
    {
      "sequence": 6,
      "elapsedRealtimeNs": 2500000,
      "source": "BOOTSTRAP_ACTIVE_NETWORK",
      "signal": "BOOTSTRAP_SNAPSHOT",
      "disposition": "UNCHANGED",
      "platformRouteRef": "p1",
      "routeEpochBefore": 1,
      "routeEpochAfter": 1,
      "observedCapabilities": null,
      "observedBlocked": null,
      "runtimeStateAfter": {
        "state": "AVAILABLE",
        "routeEpoch": 1,
        "capabilitiesReceived": true,
        "internet": "TRUE",
        "validated": "TRUE",
        "vpn": "FALSE",
        "metered": "TRUE",
        "restricted": "FALSE",
        "blocked": "FALSE",
        "suspended": "FALSE"
      }
    },
    {
      "sequence": 7,
      "elapsedRealtimeNs": 2750000,
      "source": "DEFAULT_NETWORK_CALLBACK",
      "signal": "AVAILABLE",
      "disposition": "APPLIED",
      "platformRouteRef": "p2",
      "routeEpochBefore": 1,
      "routeEpochAfter": 2,
      "observedCapabilities": null,
      "observedBlocked": null,
      "runtimeStateAfter": {
        "state": "AVAILABLE",
        "routeEpoch": 2,
        "capabilitiesReceived": false,
        "internet": "UNKNOWN",
        "validated": "UNKNOWN",
        "vpn": "UNKNOWN",
        "metered": "UNKNOWN",
        "restricted": "UNKNOWN",
        "blocked": "UNKNOWN",
        "suspended": "UNKNOWN"
      }
    },
    {
      "sequence": 8,
      "elapsedRealtimeNs": 3000000,
      "source": "DEFAULT_NETWORK_CALLBACK",
      "signal": "CAPABILITIES_CHANGED",
      "disposition": "APPLIED",
      "platformRouteRef": "p2",
      "routeEpochBefore": 2,
      "routeEpochAfter": 2,
      "observedCapabilities": {
        "internet": "TRUE",
        "validated": "TRUE",
        "vpn": "TRUE",
        "metered": "FALSE",
        "restricted": "FALSE",
        "suspended": "FALSE"
      },
      "observedBlocked": null,
      "runtimeStateAfter": {
        "state": "AVAILABLE",
        "routeEpoch": 2,
        "capabilitiesReceived": true,
        "internet": "TRUE",
        "validated": "TRUE",
        "vpn": "TRUE",
        "metered": "FALSE",
        "restricted": "FALSE",
        "blocked": "UNKNOWN",
        "suspended": "FALSE"
      }
    },
    {
      "sequence": 9,
      "elapsedRealtimeNs": 3250000,
      "source": "DEFAULT_NETWORK_CALLBACK",
      "signal": "AVAILABLE",
      "disposition": "APPLIED",
      "platformRouteRef": "p1",
      "routeEpochBefore": 2,
      "routeEpochAfter": 3,
      "observedCapabilities": null,
      "observedBlocked": null,
      "runtimeStateAfter": {
        "state": "AVAILABLE",
        "routeEpoch": 3,
        "capabilitiesReceived": false,
        "internet": "UNKNOWN",
        "validated": "UNKNOWN",
        "vpn": "UNKNOWN",
        "metered": "UNKNOWN",
        "restricted": "UNKNOWN",
        "blocked": "UNKNOWN",
        "suspended": "UNKNOWN"
      }
    },
    {
      "sequence": 10,
      "elapsedRealtimeNs": 3500000,
      "source": "DEFAULT_NETWORK_CALLBACK",
      "signal": "CAPABILITIES_CHANGED",
      "disposition": "APPLIED",
      "platformRouteRef": "p1",
      "routeEpochBefore": 3,
      "routeEpochAfter": 3,
      "observedCapabilities": {
        "internet": "TRUE",
        "validated": "FALSE",
        "vpn": "FALSE",
        "metered": "FALSE",
        "restricted": "FALSE",
        "suspended": "FALSE"
      },
      "observedBlocked": null,
      "runtimeStateAfter": {
        "state": "AVAILABLE",
        "routeEpoch": 3,
        "capabilitiesReceived": true,
        "internet": "TRUE",
        "validated": "FALSE",
        "vpn": "FALSE",
        "metered": "FALSE",
        "restricted": "FALSE",
        "blocked": "UNKNOWN",
        "suspended": "FALSE"
      }
    },
    {
      "sequence": 11,
      "elapsedRealtimeNs": 3750000,
      "source": "MONITOR_LIFECYCLE",
      "signal": "MONITOR_STOPPED",
      "disposition": "APPLIED",
      "platformRouteRef": null,
      "routeEpochBefore": 3,
      "routeEpochAfter": 3,
      "observedCapabilities": null,
      "observedBlocked": null,
      "runtimeStateAfter": {
        "state": "AVAILABLE",
        "routeEpoch": 3,
        "capabilitiesReceived": true,
        "internet": "TRUE",
        "validated": "FALSE",
        "vpn": "FALSE",
        "metered": "FALSE",
        "restricted": "FALSE",
        "blocked": "UNKNOWN",
        "suspended": "FALSE"
      }
    }
  ],
  "policyEvaluations": [
    {
      "sequence": 1,
      "routeEventSequenceWatermark": 6,
      "routeEpoch": 1,
      "guardBefore": "UNRESOLVED",
      "guardAfter": "SYSTEM_DEFAULT_ALLOWED",
      "explicitDirectOverride": false,
      "decision": "ALLOW",
      "reason": "ROUTE_READY"
    },
    {
      "sequence": 2,
      "routeEventSequenceWatermark": 8,
      "routeEpoch": 2,
      "guardBefore": "SYSTEM_DEFAULT_ALLOWED",
      "guardAfter": "SYSTEM_DEFAULT_ALLOWED",
      "explicitDirectOverride": false,
      "decision": "ALLOW",
      "reason": "ROUTE_READY"
    },
    {
      "sequence": 3,
      "routeEventSequenceWatermark": 10,
      "routeEpoch": 3,
      "guardBefore": "SYSTEM_DEFAULT_ALLOWED",
      "guardAfter": "SYSTEM_DEFAULT_ALLOWED",
      "explicitDirectOverride": false,
      "decision": "ALLOW",
      "reason": "ROUTE_READY"
    }
  ]
}
